{
  "workflow_id": "WF-org_demo_alpha-UNIT-0008",
  "outcome": "CLEAN",
  "verdict": "PASS",
  "reason": "All applicable stages passed.",
  "needs_human": false,
  "provisional": false,
  "claimable_usd": null,
  "contributing_records": [
    "RCV-0008",
    "PCK-0008",
    "RCY-UNIT-0008"
  ],
  "effective_verdicts": {
    "receiving": "PASS",
    "pack": "PASS",
    "recovery": "PASS"
  },
  "decided_by": "orchestrator",
  "decided_at": "2026-10-04T18:37:05Z"
}
